{"$schema":"https://json-schema.org/draft/2020-12/schema","title":"TraceBundle v1","type":"object","required":["trace_id","origin","external_side_effect_count","replay_id","replay_new_record_count","records"],"properties":{"trace_id":{"type":"string","minLength":1},"origin":{"enum":["synthetic","real","test","replay"]},"external_side_effect_count":{"type":"integer","minimum":0},"replay_id":{"type":"string","minLength":1},"replay_new_record_count":{"type":"integer","minimum":0},"records":{"type":"object"}}}
